{
  "label": "pi-profile-switch Dev",
  "description": "Daily development of pi-profile-switch with relevant skills and extensions",
  "skills": [
    "profile-config",
    "git-commit",
    "doc-writing",
    "team-workflow",
    "clean-architecture",
    "context7-docs",
    "context-mode",
    "pi-subagents"
  ],
  "extensions": [
    "@upstash/context7-pi",
    "context-mode",
    "pi-subagents",
    "pi-web-access"
  ]
}
